{
  "lockVersion": 1,
  "timestamp": "2021-05-11T12:00:00.000Z",
  "configurations": [
    "compile",
    "test"
  ],
  "dependencies": [
    {
      "org": "org.scala-lang",
      "name": "scala-library",
      "version": "2.12.10",
      "artifacts": [
        {
          "name": "scala-library.jar",
          "hash": "sha1:3509860bc2e5b3da001ed45aca94ffbe5694dbda"
        }
      ],
      "configurations": [
        "compile",
        "test"
      ]
    },
    {
      "org": "org.scala-lang",
      "name": "scala-reflect",
      "version": "2.12.10",
      "artifacts": [
        {
          "name": "scala-reflect.jar",
          "hash": "sha1:14cb7beb516cd8e07716133668c427792122c926"
        }
      ],
      "configurations": [
        "test"
      ]
    }
  ]
}